{
  "schema_version": "1.0",
  "task": {
    "task_id": "01JNQABC0123456789GHFEDCBA",
    "title": "Review contract drift",
    "status": "open",
    "has_code_diff": false,
    "has_verification_passed": false
  },
  "attention": {
    "task_id": "01JNQABC0123456789GHFEDCBA",
    "level": "needs_attention",
    "reasons": ["Requires review"]
  },
  "sla_summary": {
    "task_id": "01JNQABC0123456789GHFEDCBA",
    "due_soon_count": 0,
    "overdue_count": 0,
    "oldest_overdue_seconds": null,
    "highest_risk_queue": null,
    "breach_severity": "high"
  },
  "allowed_actions": [
    {
      "action_id": "act-001",
      "kind": "reassign",
      "target_kind": "task",
      "level": "needs_attention",
      "task_id": "01JNQABC0123456789GHFEDCBA",
      "handoff_id": null,
      "agent_id": null,
      "title": "Reassign to reviewer",
      "summary": "Transfer this task to the review queue",
      "due_at": null,
      "expires_at": "2026-04-26T00:00:00Z"
    }
  ],
  "evidence": [
    {
      "schema_version": "1.0",
      "evidence_id": "01JNQXYZ0123456789ABCDEFGH",
      "task_id": "01JNQABC0123456789GHFEDCBA",
      "source_kind": "manual_note",
      "source_ref": "01JNQN0TE0000000000000001A",
      "label": "Operator note"
    }
  ],
  "completion_signal": null
}
